{
  "schema_version": 1,
  "app": "ai-workbench-mobile",
  "platform": "android",
  "version": "0.1.0",
  "channel": "stable",
  "tag": "mobile-v0.1.0",
  "artifacts": [
    {
      "name": "AIWorkbench-mobile-0.1.0.apk",
      "size": 1234,
      "sha256": "aaaaaaaaaaaaaaaaaaaaaaaaaaaaaaaaaaaaaaaaaaaaaaaaaaaaaaaaaaaaaaaa"
    }
  ]
}